{
  "task_id": "P1-DATA-001", "agent": "data-engineer", "agent_version": "a0.1",
  "objective": "Snapshot-first ingestion, DuckDB schema/loaders, data-quality layer; backfill 2010-2026; daily injury snapshots",
  "hypothesis": null,
  "input_data": [{"name": "nflverse-data release assets (15 datasets, see config/sources.yaml)", "snapshot_id": null, "sha256": null}],
  "data_cutoff": "2026-10-08T13:21:00Z",
  "method": "download bytes -> sha256 -> parquet+meta+index -> DuckDB load with snapshot_id; nflverse lines labeled last_pull",
  "assumptions": ["nflverse spread_line positive = home favored", "curated pbp columns sufficient for v0", "depth charts split by format"],
  "results": {"unique_snapshots": 145, "games": 7548, "plays": 781492, "injury_rows": 87205, "historical_lines": 7369, "dq_critical": 0, "dq_warn": 2, "tests_passing": 32},
  "uncertainty": null,
  "limitations": ["odds host blocked by sandbox allowlist", "officials disabled", "2025 injuries untimestamped", "closing_lines.csv not yet ingested"],
  "unverified": [],
  "reproducibility": {"commit": "e5adeda", "commands": ["uv sync --extra dev", "uv run edgelab ingest nflverse --seasons 2010-2026", "uv run edgelab db load --seasons 2010-2026", "uv run edgelab quality"], "python": "3.13 / 3.10", "packages": {"duckdb": "1.5.6", "polars": "1.44.2", "nflreadpy": "0.1.5"}, "seed": null, "config_hash": null},
  "recommendation": "accept as Phase 1 foundation; proceed to Phase 2 after data audit",
  "artifacts": ["src/edgelab", "config", "docs/LEAKAGE_REGISTER.md", "data/metadata/snapshots.jsonl", "reports/quality/dq_20261008T131611Z.md"],
  "disagreements": [],
  "audit_status": "APPROVED_WITH_CONDITIONS",
  "next_action": "Phase 2 as-of feature builder",
  "created_at": "2026-10-08T13:35:00Z"
}
